{
  "schema": "bbk.plan-event.v1",
  "event_id": "PLAN-EVENT-FIXTURE-001",
  "transaction_id": "PLAN-TX-FIXTURE-001",
  "sequence": 1,
  "event_type": "FRONTIER_REVISED",
  "subject_ref": "frontier-fixture-1",
  "authority_ref": "authority-fixture-1",
  "predecessor_refs": [],
  "payload": {
    "revision": 1,
    "reason": "First executable continuation frontier"
  },
  "created_at": "2026-08-05T12:00:00Z"
}
